{
  "name": "François RINGLER",
  "email": "francois.ringler@gmail.com",
  "resume": {
    "full": "PERSONNEL FILE - VAULT-TEC APPROVED\n════════════════════════════════════════════════════════════════\n\nNAME: François RINGLER\nPOSITION: Senior Software Engineer\nCLEARANCE: Level 7\nCONTACT: john.doe@email.com\n\n════════════════════════════════════════════════════════════════\nSUMMARY\n════════════════════════════════════════════════════════════════\n\nHighly skilled software engineer with 8+ years of experience in developing robust applications for pre-war technology systems. Specializes in terminal interfaces and vault security protocols. Proven track record in leading development teams and implementing critical infrastructure systems.\n\n════════════════════════════════════════════════════════════════\nWORK EXPERIENCE\n════════════════════════════════════════════════════════════════\n\n[Senior Software Engineer]\nAtomic Corp | 2020 - Present\n\nLeading development of critical vault systems and terminal interfaces. Implemented security protocols for nuclear facilities. Managed a team of 5 engineers in delivering mission-critical applications for radiation-hardened environments.\n\nKey Achievements:\n- Reduced system vulnerabilities by 87%\n- Implemented new terminal security protocols\n- Led migration to updated vault control systems\n\n\n[Software Developer]\nRobCo Industries | 2017 - 2020\n\nDeveloped control systems for automated robots and security terminals. Maintained legacy COBOL systems for critical infrastructure. Collaborated with hardware teams to optimize robot response times.\n\nKey Achievements:\n- Improved robot response time by 45%\n- Maintained 99.9% uptime for security systems\n- Modernized legacy codebases\n\n\n[Junior Developer]\nVault-Tec Corporation | 2015 - 2017\n\nAssisted in development of vault management systems and resource allocation algorithms. Implemented monitoring systems for environmental controls.\n\nKey Achievements:\n- Developed resource allocation optimization\n- Created automated testing frameworks\n- Contributed to vault door control systems\n\n════════════════════════════════════════════════════════════════\nTECHNICAL SKILLS\n════════════════════════════════════════════════════════════════\n\nTerminal Interface Design [█████████░] 9/10\nSecurity Protocols [█████░░░░░] 5/10\nCOBOL & Fortran [███████░░░] 7/10\nNuclear Systems Management [██████░░░░] 6/10\nRobot Control Systems [████████░░] 8/10\nVault-Tec Certified [██████████] 10/10\nRadiation Hardened Code [███████░░░] 7/10\nLegacy System Maintenance [████████░░] 8/10\n\n════════════════════════════════════════════════════════════════\nEDUCATION\n════════════════════════════════════════════════════════════════\n\n[Master of Science in Computer Science]\nMassachusetts Institute of Technology | 2015\nFocus: Distributed Systems and Security\n\n[Bachelor of Science in Engineering]\nMassachusetts Institute of Technology | 2013\nFocus: Computer Engineering\n\n════════════════════════════════════════════════════════════════\nPERSONAL INTERESTS\n════════════════════════════════════════════════════════════════\n\n* Collecting pre-war holotapes\n* Terminal hacking competitions\n* Maintaining vintage computers\n* Nuka-Cola bottle cap collecting\n* Reading technical manuals\n\n════════════════════════════════════════════════════════════════\nEND OF FILE\n════════════════════════════════════════════════════════════════",
    "experience": [
      {
        "title": "Senior Software Engineer",
        "company": "Atomic Corp",
        "period": "2020 - Present",
        "description": "Leading development of critical vault systems and terminal interfaces. Implemented security protocols for nuclear facilities. Managed a team of 5 engineers in delivering mission-critical applications for radiation-hardened environments."
      },
      {
        "title": "Software Developer",
        "company": "RobCo Industries",
        "period": "2017 - 2020",
        "description": "Developed control systems for automated robots and security terminals. Maintained legacy COBOL systems for critical infrastructure. Collaborated with hardware teams to optimize robot response times."
      },
      {
        "title": "Junior Developer",
        "company": "Vault-Tec Corporation",
        "period": "2015 - 2017",
        "description": "Assisted in development of vault management systems and resource allocation algorithms. Implemented monitoring systems for environmental controls."
      }
    ],
    "skills": [
      { "name": "Terminal Interface Design", "level": 9 },
      { "name": "Security Protocols", "level": 5 },
      { "name": "COBOL & Fortran", "level": 7 },
      { "name": "Nuclear Systems Management", "level": 6 },
      { "name": "Robot Control Systems", "level": 8 },
      { "name": "Vault-Tec Certified", "level": 10 },
      { "name": "Radiation Hardened Code", "level": 7 },
      { "name": "Legacy System Maintenance", "level": 8 }
    ],
    "schools": [
      {
        "degree": "Master of Science in Computer Science",
        "school": "Massachusetts Institute of Technology",
        "year": "2015"
      },
      {
        "degree": "Bachelor of Science in Engineering",
        "school": "MIT",
        "year": "2013"
      }
    ],
    "hobbies": [
      "Collecting pre-war holotapes",
      "Terminal hacking competitions",
      "Maintaining vintage computers",
      "Nuka-Cola bottle cap collecting",
      "Reading technical manuals"
    ]
  }
}